{
  "specVersion": "0.2.0",
  "projectId": "harmonic-audio-analytics",
  "projectName": "Harmonic Audio — Fan Engagement Analytics",
  "projectDescription": "Fictional streaming audio company. Five source systems (frontend events, backend app DB, third-party SaaS) feed three product domains — growth, marketing, finance — through a full staging/intermediate/mart pipeline with metrics and dashboards.",
  "domains": ["growth", "marketing", "finance"],
  "layerDefinitions": [
    { "id": "layer-source", "name": "Source", "type": "source", "order": 0 },
    { "id": "layer-raw", "name": "Raw", "type": "raw", "order": 1 },
    { "id": "layer-staging", "name": "Staging", "type": "staging", "order": 2 },
    { "id": "layer-intermediate", "name": "Intermediate", "type": "intermediate", "order": 3 },
    { "id": "layer-mart", "name": "Mart", "type": "mart", "order": 4, "domains": ["growth", "marketing", "finance"] },
    { "id": "layer-semantic", "name": "Semantic", "type": "semantic", "order": 5 },
    { "id": "layer-consumption", "name": "Consumption", "type": "consumption", "order": 6 }
  ],
  "models": [
    {
      "id": "src-snowplow",
      "layerId": "layer-source",
      "name": "snowplow",
      "displayName": "Snowplow (web + mobile events)",
      "description": "Frontend behavioral event stream for web and mobile clients.",
      "columns": [],
      "sourceClassification": { "origin": "frontend", "ingestionMethod": "event_stream" },
      "trustLevel": "trusted",
      "status": "active",
      "ownerId": "owner-maya-chen",
      "teamId": "team-data-platform"
    },
    {
      "id": "src-segment",
      "layerId": "layer-source",
      "name": "segment",
      "displayName": "Segment (marketing events)",
      "description": "Frontend CDP — marketing-instrumented events (signup, play, upgrade prompts).",
      "columns": [],
      "sourceClassification": { "origin": "frontend", "ingestionMethod": "event_stream" },
      "trustLevel": "reviewed",
      "status": "active",
      "ownerId": "owner-priya-rao",
      "teamId": "team-marketing-eng"
    },
    {
      "id": "src-app-postgres",
      "layerId": "layer-source",
      "name": "app_postgres",
      "displayName": "App DB (Postgres CDC)",
      "description": "Primary transactional database for fans, artists, and playlists. Ingested via change-data-capture.",
      "columns": [],
      "sourceClassification": { "origin": "backend", "ingestionMethod": "cdc" },
      "trustLevel": "trusted",
      "status": "active",
      "ownerId": "owner-dan-ortiz",
      "teamId": "team-data-platform"
    },
    {
      "id": "src-stripe",
      "layerId": "layer-source",
      "name": "stripe",
      "displayName": "Stripe Billing",
      "description": "Third-party billing provider for subscriptions, invoices, and dunning.",
      "columns": [],
      "sourceClassification": { "origin": "third_party", "ingestionMethod": "batch_api" },
      "trustLevel": "trusted",
      "status": "active",
      "ownerId": "owner-maya-chen",
      "teamId": "team-data-platform"
    },
    {
      "id": "src-hubspot",
      "layerId": "layer-source",
      "name": "hubspot",
      "displayName": "HubSpot CRM",
      "description": "Third-party CRM — contacts, lead-to-customer stages, campaign metadata.",
      "columns": [],
      "sourceClassification": { "origin": "third_party", "ingestionMethod": "batch_api" },
      "trustLevel": "reviewed",
      "status": "active",
      "ownerId": "owner-priya-rao",
      "teamId": "team-marketing-eng"
    },

    {
      "id": "raw-snowplow-events",
      "layerId": "layer-raw",
      "name": "raw_snowplow_events",
      "displayName": "Raw Snowplow Events",
      "description": "Append-only landing table for Snowplow enriched events.",
      "grain": "event",
      "columns": [
        { "id": "raw-snowplow-events-event-id", "name": "event_id", "dataType": "varchar(64)", "logicalType": "string", "description": "Snowplow event UUID", "isPrimaryKey": true },
        { "id": "raw-snowplow-events-event-ts", "name": "event_ts", "dataType": "timestamp_tz", "logicalType": "timestamp", "description": "Collector timestamp" },
        { "id": "raw-snowplow-events-user-id", "name": "user_id", "dataType": "varchar(64)", "logicalType": "string", "description": "Hashed fan id" },
        { "id": "raw-snowplow-events-artist-id", "name": "artist_id", "dataType": "varchar(64)", "logicalType": "string", "description": "Artist dimension key" },
        { "id": "raw-snowplow-events-event-name", "name": "event_name", "dataType": "varchar(128)", "logicalType": "string", "description": "Self-describing event name" }
      ],
      "trustLevel": "reviewed",
      "status": "active",
      "ownerId": "owner-maya-chen",
      "teamId": "team-data-platform"
    },
    {
      "id": "raw-segment-track",
      "layerId": "layer-raw",
      "name": "raw_segment_track",
      "displayName": "Raw Segment Track",
      "description": "Landing table for Segment track-call payloads.",
      "grain": "event",
      "columns": [
        { "id": "raw-seg-track-event-id", "name": "event_id", "dataType": "varchar(64)", "logicalType": "string", "description": "Segment message id", "isPrimaryKey": true },
        { "id": "raw-seg-track-user-id", "name": "user_id", "dataType": "varchar(64)", "logicalType": "string", "description": "Segment user id" },
        { "id": "raw-seg-track-event", "name": "event", "dataType": "varchar(128)", "logicalType": "string", "description": "Event name" },
        { "id": "raw-seg-track-properties", "name": "properties", "dataType": "variant", "logicalType": "json", "description": "Event properties blob" },
        { "id": "raw-seg-track-received-at", "name": "received_at", "dataType": "timestamp_tz", "logicalType": "timestamp", "description": "Ingestion timestamp" }
      ],
      "trustLevel": "reviewed",
      "status": "active",
      "ownerId": "owner-priya-rao",
      "teamId": "team-marketing-eng"
    },
    {
      "id": "raw-app-users",
      "layerId": "layer-raw",
      "name": "raw_app_users",
      "displayName": "Raw App Users (CDC)",
      "description": "CDC mirror of the users table from the application Postgres database.",
      "grain": "user_id",
      "columns": [
        { "id": "raw-app-users-user-id", "name": "user_id", "dataType": "varchar(64)", "logicalType": "string", "description": "Fan account identifier", "isPrimaryKey": true },
        { "id": "raw-app-users-email", "name": "email", "dataType": "varchar(256)", "logicalType": "string", "description": "Contact email (hashed)" },
        { "id": "raw-app-users-display-name", "name": "display_name", "dataType": "varchar(256)", "logicalType": "string", "description": "User display name" },
        { "id": "raw-app-users-signup-ts", "name": "signup_ts", "dataType": "timestamp_tz", "logicalType": "timestamp", "description": "Account creation timestamp" },
        { "id": "raw-app-users-country", "name": "country", "dataType": "varchar(2)", "logicalType": "string", "description": "ISO-3166 country code" }
      ],
      "trustLevel": "reviewed",
      "status": "active",
      "ownerId": "owner-dan-ortiz",
      "teamId": "team-data-platform"
    },
    {
      "id": "raw-stripe-subscriptions",
      "layerId": "layer-raw",
      "name": "raw_stripe_subscriptions",
      "displayName": "Raw Stripe Subscriptions",
      "description": "Landing table for Stripe subscription records.",
      "grain": "subscription_id",
      "columns": [
        { "id": "raw-stripe-subs-subscription-id", "name": "subscription_id", "dataType": "varchar(64)", "logicalType": "string", "description": "Stripe subscription UUID", "isPrimaryKey": true },
        { "id": "raw-stripe-subs-user-id", "name": "user_id", "dataType": "varchar(64)", "logicalType": "string", "description": "Fan account identifier" },
        { "id": "raw-stripe-subs-plan-name", "name": "plan_name", "dataType": "varchar(128)", "logicalType": "string", "description": "Subscription plan name" },
        { "id": "raw-stripe-subs-status", "name": "status", "dataType": "varchar(32)", "logicalType": "string", "description": "Stripe subscription status" },
        { "id": "raw-stripe-subs-mrr", "name": "mrr_cents", "dataType": "integer", "logicalType": "integer", "description": "Monthly recurring revenue in cents" },
        { "id": "raw-stripe-subs-created-at", "name": "created_at", "dataType": "timestamp_tz", "logicalType": "timestamp", "description": "Subscription creation timestamp" }
      ],
      "trustLevel": "reviewed",
      "status": "active",
      "ownerId": "owner-maya-chen",
      "teamId": "team-data-platform"
    },
    {
      "id": "raw-hubspot-contacts",
      "layerId": "layer-raw",
      "name": "raw_hubspot_contacts",
      "displayName": "Raw HubSpot Contacts",
      "description": "Landing table for HubSpot contact records including lifecycle stage and campaign attribution.",
      "grain": "hubspot_contact_id",
      "columns": [
        { "id": "raw-hs-contact-id", "name": "contact_id", "dataType": "varchar(64)", "logicalType": "string", "description": "HubSpot contact id", "isPrimaryKey": true },
        { "id": "raw-hs-email", "name": "email", "dataType": "varchar(256)", "logicalType": "string", "description": "Contact email" },
        { "id": "raw-hs-lifecycle-stage", "name": "lifecycle_stage", "dataType": "varchar(64)", "logicalType": "string", "description": "Lead lifecycle stage" },
        { "id": "raw-hs-first-campaign", "name": "first_campaign_id", "dataType": "varchar(64)", "logicalType": "string", "description": "First-touch campaign id" },
        { "id": "raw-hs-created-ts", "name": "created_ts", "dataType": "timestamp_tz", "logicalType": "timestamp", "description": "Contact creation timestamp" }
      ],
      "trustLevel": "draft",
      "status": "active",
      "ownerId": "owner-priya-rao",
      "teamId": "team-marketing-eng"
    },

    {
      "id": "stg-snowplow-events-clean",